{"cardOrder":["card-1","card-2","card-3","card-4","card-5","card-6","card-7"],"codec":"png","dimensions":{"height":1350,"width":1080},"environment":{"browser":"chromium","browserRevision":"playwright-1.62.0","deviceScaleFactor":1,"locale":"ko-KR","platform":"linux","timezone":"Asia/Seoul"},"renderSpecId":"render-seed-library","schemaVersion":"1.0.0","target":{"id":"portrait-social-1080x1350","version":"1.0.0"},"theme":{"id":"ink-paper","version":"2.0.0"},"visualRecipeDigest":"442a76478243c71b9612ec680a4d89903a1451dc3438a976e87d3ddcc73340ca"}